{
  "$schema": "https://json-schema.org/draft-07/schema#",
  "$id": "https://example.invalid/monorepo-profiles/profile.schema.json",
  "title": "monorepo-profiles profile",
  "type": "object",
  "additionalProperties": false,
  "required": ["name"],
  "properties": {
    "name": {
      "type": "string",
      "pattern": "^[a-zA-Z0-9_-]+$",
      "description": "Must equal the JSON filename stem."
    },
    "description": { "type": "string" },
    "mcp_servers": {
      "type": "object",
      "description": "Same shape as .mcp.json's mcpServers. Profile fully owns this key.",
      "additionalProperties": {
        "type": "object",
        "anyOf": [
          { "required": ["command"] },
          { "required": ["url"] }
        ],
        "properties": {
          "command": { "type": "string" },
          "args": { "type": "array", "items": { "type": "string" } },
          "env": { "type": "object", "additionalProperties": { "type": "string" } },
          "url": { "type": "string" }
        }
      }
    },
    "permissions": {
      "type": "object",
      "additionalProperties": false,
      "properties": {
        "allow": { "type": "array", "items": { "type": "string" } },
        "deny":  { "type": "array", "items": { "type": "string" } }
      }
    },
    "plugins": {
      "type": "array",
      "items": {
        "type": "string",
        "pattern": "^[\\w-]+@[\\w-]+$",
        "description": "Plugin id in the form 'name@marketplace'."
      }
    },
    "local_skills": {
      "type": "string",
      "description": "Path relative to repo root pointing to a directory of skills."
    },
    "local_agents": {
      "type": "string",
      "description": "Path relative to repo root pointing to a directory of agents."
    },
    "instruction_fragments": {
      "type": "array",
      "description": "Supplementary fragments not on the CLAUDE.md cwd cascade.",
      "items": { "type": "string" }
    }
  }
}
